{
  "schema_version": "lab.restore_lease.v1",
  "lease_id": "LEASE-001",
  "target_id": "pi4-target55",
  "operation_id": "linux.cpufreq.set_governor",
  "captured_state": {
    "cpufreq_policies": [
      {
        "policy": "policy0",
        "governor": "ondemand",
        "scaling_min_freq": "600000",
        "scaling_max_freq": "1800000"
      }
    ]
  },
  "applied_state": {
    "governor": "performance"
  },
  "restore_required": true,
  "restore_status": "pending",
  "created_by_plan": "PLAN-001",
  "time_unix_ms": 1780000000000
}
